<?xml version='1.0' encoding='utf-8'?>
<index xmlns="https://www.mhlw.go.jp/stf/seisakunitsuite/bunya/0000161103.html" xmlns:xsi="http://www.w3.org/2001/XMLSchema-instance" xsi:schemaLocation="https://www.mhlw.go.jp/stf/seisakunitsuite/bunya/0000161103.html ix08_V08.xsd">
  <interactionType code="1"/>
  <creationTime value="20231115"/>
  <sender>
    <id root="1.2.392.200119.6.102" extension="MySenderOrg"/>
  </sender>
  <receiver>
    <id root="1.2.392.200119.6.101" extension="ThePayer"/>
  </receiver>
  <serviceEventType code="1"/>
  <totalRecordCount value="250"/>
</index>
